### ISSUE TITLE
Gateway does not close the array filter connection

### ISSUE THREAD

**Issue by mnabywan** [epics-extensions/ca-gateway#70]
I was trying to use a `camonitor` with an [array filters](https://docs.epics-controls.org/projects/base/en/latest/filters.html#array-filter-arr) (as it's a nice way to check specific elements from a waveform).
I did that from my computer through the CA gateway.

However I made a typo and because the `dbChannelCreate` failed. I think I realized that and stopped the camonitor.

After some time I realized that  the messages were appearing every 10 seconds in the IOC console.
However, even after restarting my computer and the IOC, seems like still the client tried to create a channel.

```
> dbChannelCreate: lexical error: invalid char in json text.
                                  {arr:s:2000
                     (right here) ------^

dbChannelCreate: lexical error: invalid char in json text.
                                  {arr:i:0
                     (right here) ------^

dbChannelCreate: lexical error: invalid char in json text.
                                  {arr:e:-1
                     (right here) ------^

dbChannelCreate: parse error: premature EOF
                                       {"arr":{"s":2000,"i":0,"e":-1}
                     (right here) ------^

```

I tried also to use `casr` command, but I didn't find any channels with filters.

Later, I run the tcpdump command from the IOC host and I saw that there is some traffic from IOC host to the gateway with that array filter (172.30.9.11 is the gateway address).

```
16:18:25.712584 enp22s0 B   IP 172.30.4.143.41948 > 172.30.7.255.5064: UDP, length 80
E..lz.@.@.[..............X.x.........6n........0.......J...JTgt-TWDS1000:Mech-Sect-31:T_Cup_Diff_LL1_RB.....
16:18:25.722480 enp22s0 B   IP 172.30.9.11.50547 > 172.30.7.255.5064: UDP, length 408
E.....@.@..\..  ......s....
...........\m.......0......4...4.TIGER-010:RFS-DIG-101:Dwn0-Cmp0.{arr:s:2000........0......4...4.TIGER-010:RFS-DIG-101>
16:18:25.722525 enp22s0 Out IP 172.30.5.254.5064 > 172.30.9.11.50547: UDP, length 112
E...Oa@.@.........      ....s.xg...........\m..................4.......................4.......................4......>
16:18:25.728697 enp22s0 B   IP 172.30.4.143.38807 > 172.30.7.255.5064: UDP, length 64
E..\z.@.@.[..............HO..........4......... .......4...4LAB:LAMP1:Direction0_RBV........
16:18:25.730675 enp22s0 B   IP 172.30.4.143.40976 > 172.30.7.255.5064: UDP, length 56
E..Tz.@.@.[..............@.g.........9K................k...kMPOD:mod_1::setDoClear..
16:18:25.732023 enp22s0 B   IP 172.30.4.143.49628 > 172.30.7.255.5064: UDP, length 120
E...z.@.@.[t..............f..........17i....... ............LAB-010RFC:RFS-DIG-101:Dwn5-Fmt....(............LAB-010RFC>
16:18:25.753689 enp22s0 B   IP 172.30.4.143.41948 > 172.30.7.255.5064: UDP, length 64

```

Seems like gateway didn't close the channel correctly.

Restarting the gateway solved the issue.

**Comment by ralphlange** [comment]
How long was "some time"?

One of the core functionalities of the CA Gateway is to keep upstream (IOC side) connections open for a while after the last interested downstream client disconnected. This is minimizing the name resolution traffic on the IOC, especially when rogue downstream clients do name resolution of the same channel repeatedly in a fast loop (e.g., calling `caget` inside a loop in a bash script).

The time before the upstream connection is closed (or the Gateway stops trying to open it) is configurable through command line arguments (default is 2 hours). See `gateway -h` or the documentation for more details.

Please check if the Gateway's reconnect is still happening after that time span - only in that case this would be unexpected behavior.

**Comment by jacomago** [comment]
Seems like to me many problems:

- dbChannelCreate fails but did not shut down the monitor and connection
- The gateway keeps open the connection (sure there is a long default)
- No early validation of the request: this would be a feature request to allow blocking invalid filters. 

I know ca does not know about filters, but that doesn't mean you can't have a custom 'block ca requests of type blah' to have early validation. And I think this was just invalid json, so easier to check.

**Comment by mnabywan** [comment]
@ralphlange, I left the IOC running in that state for like 16 hours and these error messages were still appearing.

**Comment by anjohnson** [comment]
It looks like the Gateway is getting confused when the base channel name resolves (with the filter removed) so the client library gets a UDP reply, but opening the channel through TCP gets rejected because that parses the JSON filter which rejects the PV name. I wonder if searching for a non-existent field name of a real record has the same effect? I hesitate to try it here to avoid having to restart one of our operational gateways.

**Comment by simon-ess** [comment]
We have a playbook for setting up the CA gateway. I should be able to run a test similar to my p4p gateway tests that allow this to be somewhat isolated...
